{
  "schemaVersion": 1,
  "decision": "retain-contained-sdk",
  "bindings": {
    "providerRegistrySha256": "4baa7dddaabc5065b2f5b479852bd47324f021470608db1f5a11b638852c24bd",
    "lockfileSha256": "56f62337d5fe09489b938c2f6053b52e63580b0f65e19248863fef50e84daeb9",
    "stripeGatewaySourceSha256": "5dfa94799c2641c936cc614d17fdfb504cc3390939692c502bfe75780f70814e",
    "providerManifestSha256": "925fb7a001276aae145d3337b9280e8d9028d3482f0c334dd06d175d9d9bf74d",
    "evaluationImplementationSha256": "c40dce75e3238892b77dbe358e3f66945fc54ab6921803644d7a29c79785b959",
    "localEvidenceSha256": "8f5fde9618b48811e119a1b523417cf1b4d0e3317cc4ff470b5c120f500a5cde",
    "decisionInputsSha256": "21b5a0621e21f6929e6ecb4b8f10486375731b8deae441087a747cd316bee871"
  },
  "containedSdk": {
    "package": "stripe",
    "declaredRange": "^22.2.0",
    "resolvedVersion": "22.3.0",
    "lockIntegrity": "sha512-ypO6xjVrMWs9SmIMeHr8naCx3dAQ0clxMdUTxn7Ejd7hmY9meBGfE+N4pVHkf9sUNebAHp6uJo6mV3GxDIc2cA==",
    "dependencyClass": "dependencies",
    "runtimeImportPath": "packages/provider-clients/src/stripe.ts",
    "testOnlyPlacements": [
      {
        "manifest": "packages/api/package.json",
        "dependencyClass": "devDependencies",
        "importPath": "packages/api/src/__tests__/integration/stripe-connect-provider.integration.test.ts"
      },
      {
        "manifest": "packages/workflows/package.json",
        "dependencyClass": "devDependencies",
        "importPath": "packages/workflows/src/__tests__/stripe-provider.integration.test.ts"
      }
    ],
    "logicalInstalledBytes": 15875598,
    "logicalInstalledFiles": 1424,
    "logicalContentSha256": "cf582e033d42abdf98101f4700e10516958692f366501ca4cb631ae20203251d",
    "operations": [
      {
        "id": "account-link.create",
        "method": "POST",
        "path": "/v1/account_links",
        "sideEffecting": true,
        "idempotencyRequired": true,
        "localRequestShapeProof": true
      },
      {
        "id": "connect-account.create",
        "method": "POST",
        "path": "/v1/accounts",
        "sideEffecting": true,
        "idempotencyRequired": true,
        "localRequestShapeProof": true
      },
      {
        "id": "connect-account.delete",
        "method": "DELETE",
        "path": "/v1/accounts/{accountId}",
        "sideEffecting": true,
        "idempotencyRequired": true,
        "localRequestShapeProof": true
      },
      {
        "id": "connect-account.retrieve",
        "method": "GET",
        "path": "/v1/accounts/{accountId}",
        "sideEffecting": false,
        "idempotencyRequired": false,
        "localRequestShapeProof": true
      },
      {
        "id": "payment-intent.cancel",
        "method": "POST",
        "path": "/v1/payment_intents/{paymentIntentId}/cancel",
        "sideEffecting": true,
        "idempotencyRequired": true,
        "localRequestShapeProof": true
      },
      {
        "id": "payment-intent.create",
        "method": "POST",
        "path": "/v1/payment_intents",
        "sideEffecting": true,
        "idempotencyRequired": true,
        "localRequestShapeProof": true
      },
      {
        "id": "payment-intent.retrieve",
        "method": "GET",
        "path": "/v1/payment_intents/{paymentIntentId}",
        "sideEffecting": false,
        "idempotencyRequired": false,
        "localRequestShapeProof": true
      },
      {
        "id": "refund.create",
        "method": "POST",
        "path": "/v1/refunds",
        "sideEffecting": true,
        "idempotencyRequired": true,
        "localRequestShapeProof": true
      }
    ],
    "diagnostics": {
      "status": true,
      "statusText": false,
      "contentType": false,
      "responseSize": false,
      "responseClassification": false,
      "bodyDigest": false,
      "retryAfter": true,
      "hashedRequestId": true,
      "exactRequestIdIncidentSink": true,
      "providerBackedProof": false
    },
    "retainedRuntimeResponsibilities": [
      "api-error-deserialization",
      "api-version-compatibility",
      "authentication-header-construction",
      "form-encoding",
      "http-transport",
      "webhook-signature-verification"
    ]
  },
  "directCandidate": {
    "state": "bounded-wire-prototype-unproven",
    "shippingRuntime": false,
    "networkCallsPerformed": false,
    "operations": [
      {
        "id": "account-link.create",
        "method": "POST",
        "path": "/v1/account_links",
        "sideEffecting": true,
        "idempotencyRequired": true,
        "localRequestShapeProof": true
      },
      {
        "id": "connect-account.create",
        "method": "POST",
        "path": "/v1/accounts",
        "sideEffecting": true,
        "idempotencyRequired": true,
        "localRequestShapeProof": true
      },
      {
        "id": "connect-account.delete",
        "method": "DELETE",
        "path": "/v1/accounts/{accountId}",
        "sideEffecting": true,
        "idempotencyRequired": true,
        "localRequestShapeProof": true
      },
      {
        "id": "connect-account.retrieve",
        "method": "GET",
        "path": "/v1/accounts/{accountId}",
        "sideEffecting": false,
        "idempotencyRequired": false,
        "localRequestShapeProof": true
      },
      {
        "id": "payment-intent.cancel",
        "method": "POST",
        "path": "/v1/payment_intents/{paymentIntentId}/cancel",
        "sideEffecting": true,
        "idempotencyRequired": true,
        "localRequestShapeProof": true
      },
      {
        "id": "payment-intent.create",
        "method": "POST",
        "path": "/v1/payment_intents",
        "sideEffecting": true,
        "idempotencyRequired": true,
        "localRequestShapeProof": true
      },
      {
        "id": "payment-intent.retrieve",
        "method": "GET",
        "path": "/v1/payment_intents/{paymentIntentId}",
        "sideEffecting": false,
        "idempotencyRequired": false,
        "localRequestShapeProof": true
      },
      {
        "id": "refund.create",
        "method": "POST",
        "path": "/v1/refunds",
        "sideEffecting": true,
        "idempotencyRequired": true,
        "localRequestShapeProof": true
      }
    ],
    "diagnostics": {
      "status": false,
      "statusText": false,
      "contentType": false,
      "responseSize": false,
      "responseClassification": false,
      "bodyDigest": false,
      "retryAfter": false,
      "hashedRequestId": false,
      "exactRequestIdIncidentSink": false,
      "providerBackedProof": false
    },
    "stripeRuntimeDependencyStillRequired": true,
    "stripeRuntimeDependencyReason": "webhook-signature-verification-runtime-boundary"
  },
  "parityGates": [
    {
      "id": "api-version-header-local",
      "required": true,
      "status": "passed",
      "evidence": "scripts/__tests__/stripe-sdk-evaluation.test.mjs"
    },
    {
      "id": "api-version-upgrade-provider",
      "required": true,
      "status": "not-run",
      "evidence": null
    },
    {
      "id": "connect-provider",
      "required": true,
      "status": "not-run",
      "evidence": null
    },
    {
      "id": "connect-transfer-local",
      "required": true,
      "status": "passed",
      "evidence": "scripts/__tests__/stripe-sdk-evaluation.test.mjs"
    },
    {
      "id": "form-encoding-local",
      "required": true,
      "status": "passed",
      "evidence": "scripts/__tests__/stripe-sdk-evaluation.test.mjs"
    },
    {
      "id": "hosted-elements-provider",
      "required": true,
      "status": "not-run",
      "evidence": null
    },
    {
      "id": "idempotency-header-local",
      "required": true,
      "status": "passed",
      "evidence": "scripts/__tests__/stripe-sdk-evaluation.test.mjs"
    },
    {
      "id": "malformed-wire-diagnostics-provider",
      "required": true,
      "status": "not-run",
      "evidence": null
    },
    {
      "id": "orphan-compensation-provider",
      "required": true,
      "status": "not-run",
      "evidence": null
    },
    {
      "id": "payment-intent-provider",
      "required": true,
      "status": "not-run",
      "evidence": null
    },
    {
      "id": "refund-provider",
      "required": true,
      "status": "not-run",
      "evidence": null
    },
    {
      "id": "retry-replay-provider",
      "required": true,
      "status": "not-run",
      "evidence": null
    },
    {
      "id": "webhook-provider",
      "required": true,
      "status": "not-run",
      "evidence": null
    }
  ],
  "benefitThresholds": {
    "minimumDependencyBytesRemoved": 1048576,
    "minimumDependencyPercentRemoved": 25,
    "minimumStartupMedianMsReduction": 10,
    "minimumStartupPercentReduction": 20,
    "minimumNewDiagnosticFields": 4
  },
  "benefitMeasurements": {
    "dependencyBytesRemoved": 0,
    "dependencyPercentRemoved": 0,
    "startupMedianMsReduction": 0,
    "startupPercentReduction": 0,
    "newDiagnosticFields": 0,
    "dependencyBenefitPass": false,
    "startupBenefitPass": false,
    "diagnosticBenefitPass": false,
    "materialBenefitPass": false
  },
  "startupMeasurement": {
    "runtime": "node@24.4.1 darwin-arm64",
    "warmups": 5,
    "samplesPerCase": 30,
    "containedSdkMs": {
      "samples": [
        74.647, 74.567, 74.297, 74.548, 74.944, 80.326, 71.478, 68.183, 65.269, 66.807, 70.602,
        71.718, 88.358, 78.673, 72.652, 75.095, 83.026, 86.737, 74.175, 76.937, 77.274, 75.232,
        73.655, 91.13, 74.25, 83.45, 79.082, 75.035, 74.327, 73.086
      ],
      "median": 74.647,
      "p95": 88.358,
      "minimum": 65.269,
      "maximum": 91.13
    },
    "directCandidateMs": {
      "samples": [
        30.827, 30.647, 29.89, 30.487, 30.23, 30.8, 31.767, 26.597, 27.106, 28.334, 27.065, 27.198,
        30.113, 36.711, 27.023, 28.376, 28.729, 30.869, 29.666, 32.883, 29.182, 29.358, 29.42,
        31.49, 30.274, 31.09, 35.391, 30.207, 34.037, 29.298
      ],
      "median": 30.207,